{
  "$schema": "https://json-schema.org/draft/2020-12/schema",
  "$id": "https://codecks.dev/schemas/autonomous-maturity-m15-clipboard-battery-v1.schema.json",
  "type": "object",
  "additionalProperties": false,
  "required": ["schema", "milestone", "status", "scope", "generatedAtUtc", "sourceCommit", "sources", "unitResult", "managedResult", "lanes", "privacy", "summary", "limitations"],
  "properties": {
    "schema": {"const": "codecks.autonomous-maturity.m15-clipboard-battery.v1"},
    "milestone": {"const": "M15"},
    "status": {"const": "PASS"},
    "scope": {"const": "CPU_AND_MANAGED_SOURCE_ARTIFACT_BOUND"},
    "generatedAtUtc": {"type": "string", "pattern": "^\\d{4}-\\d{2}-\\d{2}T\\d{2}:\\d{2}:\\d{2}(?:\\.\\d+)?Z$"},
    "sourceCommit": {"type": "string", "pattern": "^[0-9a-f]{40}$"},
    "sources": {
      "type": "array", "minItems": 18, "maxItems": 18,
      "items": {"type": "object", "additionalProperties": false, "required": ["path", "sha256"], "properties": {"path": {"type": "string", "minLength": 1}, "sha256": {"type": "string", "pattern": "^[0-9a-f]{64}$"}}}
    },
    "unitResult": {
      "type": "object", "additionalProperties": false,
      "required": ["path", "sha256", "timestamp", "className", "methods", "tests", "failures", "errors", "skipped"],
      "properties": {
        "path": {"type": "string", "minLength": 1}, "sha256": {"type": "string", "pattern": "^[0-9a-f]{64}$"},
        "timestamp": {"type": "string", "minLength": 1}, "className": {"const": "io.codecks.ui.clipboard.M15ClipboardCharacterizationTest"},
        "methods": {"type": "array", "minItems": 10, "maxItems": 10, "uniqueItems": true, "items": {"type": "string", "minLength": 1}},
        "tests": {"const": 10}, "failures": {"const": 0}, "errors": {"const": 0}, "skipped": {"const": 0}
      }
    },
    "managedResult": {
      "type": "object", "additionalProperties": false,
      "required": ["artifactKind", "executedBinaryBinding", "path", "sha256", "timestamp", "className", "methods", "device", "flavor", "tests", "failures", "errors", "skipped", "targetArtifact", "testArtifact"],
      "properties": {
        "artifactKind": {"const": "SANITIZED_JUNIT_METADATA"}, "executedBinaryBinding": {"const": "APK_DIGESTS_BOUND"},
        "path": {"type": "string", "minLength": 1}, "sha256": {"type": "string", "pattern": "^[0-9a-f]{64}$"},
        "timestamp": {"type": "string", "minLength": 1}, "className": {"const": "io.codecks.ui.clipboard.M15ClipboardPrivacyInstrumentedTest"},
        "methods": {"type": "array", "minItems": 2, "maxItems": 2, "uniqueItems": true, "items": {"type": "string", "minLength": 1}},
        "device": {"const": "pixel6Api35"}, "flavor": {"const": "playInternal"},
        "tests": {"const": 2}, "failures": {"const": 0}, "errors": {"const": 0}, "skipped": {"const": 0},
        "targetArtifact": {"$ref": "#/$defs/artifact"}, "testArtifact": {"$ref": "#/$defs/artifact"}
      }
    },
    "lanes": {
      "type": "array", "minItems": 17, "maxItems": 17,
      "items": {"type": "object", "additionalProperties": false, "required": ["id", "status", "evidence", "code"], "properties": {"id": {"type": "string", "minLength": 1}, "status": {"enum": ["PASS", "NOT_RUN"]}, "evidence": {"enum": ["CPU_UNIT", "MANAGED_EMULATOR_PROXY", "RUNTIME_OR_EXTERNAL"]}, "code": {"enum": ["exact_test_passed", "held_or_unavailable"]}}}
    },
    "privacy": {
      "type": "object", "additionalProperties": false,
      "required": ["clipboardContentRecorded", "processOutputRecorded", "hostIdentityRecorded", "credentialRecorded"],
      "properties": {"clipboardContentRecorded": {"const": false}, "processOutputRecorded": {"const": false}, "hostIdentityRecorded": {"const": false}, "credentialRecorded": {"const": false}}
    },
    "summary": {"type": "object", "additionalProperties": false, "required": ["pass", "fail", "notRun"], "properties": {"pass": {"const": 11}, "fail": {"const": 0}, "notRun": {"const": 6}}},
    "limitations": {"type": "array", "minItems": 4, "maxItems": 4, "uniqueItems": true, "items": {"type": "string", "minLength": 1}}
  },
  "$defs": {
    "artifact": {
      "type": "object", "additionalProperties": false,
      "required": ["path", "applicationId", "sha256"],
      "properties": {
        "path": {"type": "string", "minLength": 1},
        "applicationId": {"type": "string", "minLength": 1},
        "sha256": {"type": "string", "pattern": "^[0-9a-f]{64}$"}
      }
    }
  }
}
