{
  "schema": "codecks.autonomous-maturity.m15-clipboard-battery.v1",
  "milestone": "M15",
  "status": "PASS",
  "scope": "CPU_AND_MANAGED_SOURCE_ARTIFACT_BOUND",
  "generatedAtUtc": "2026-08-17T23:08:09.696304Z",
  "sourceCommit": "5757c7195e7fa1c39b1c12bcf01a0947d0e64c38",
  "sources": [
    {
      "path": "app/src/main/java/io/codecks/AppCompositionRoot.kt",
      "sha256": "2459acc6a1ebca31f8a1beb3b282535e9432fbc25801a31bd412b48f81bb8619"
    },
    {
      "path": "app/src/main/java/io/codecks/data/clipboard/ClipboardLastSyncStore.kt",
      "sha256": "72d8fa2ea82e9ec68e526ef073f1737ba453b15f3c1fb409079c6d61c79b326b"
    },
    {
      "path": "app/src/main/java/io/codecks/domain/clipboard/ClipboardBatteryPolicy.kt",
      "sha256": "9e026b617a05e6140a30a7ec91bcfd74eec59c34833c665f43124c71b58d1227"
    },
    {
      "path": "app/src/main/java/io/codecks/domain/clipboard/ClipboardReceipt.kt",
      "sha256": "128ccafe54473a73e5e8aae610aaa65ec5be3a9ae58482c04be45a64f4ad3532"
    },
    {
      "path": "app/src/main/java/io/codecks/domain/clipboard/ClipboardSessionState.kt",
      "sha256": "d67e8d92bd5c0a1be77abf201e57faa0200e3a1581da52f7484065b1dd35c0f8"
    },
    {
      "path": "app/src/main/java/io/codecks/domain/clipboard/ClipboardSyncEngine.kt",
      "sha256": "a844e0fefd42dbeb3bc913bd20c16a8667a081616d22689900ee95e693321142"
    },
    {
      "path": "app/src/main/java/io/codecks/ui/clipboard/ClipboardBatterySettings.kt",
      "sha256": "ebeb191466c350eb69cfc03c53b0344d941918ef5ac74652c1833c35714c569f"
    },
    {
      "path": "app/src/main/java/io/codecks/ui/clipboard/ClipboardClipFactory.kt",
      "sha256": "dacd60c7c99d6e8ab23ba8d841b124a8b2024eab6fe5c937ba287a7964a8fdef"
    },
    {
      "path": "app/src/main/java/io/codecks/ui/clipboard/ClipboardScreen.kt",
      "sha256": "76eeb5f9018d4f418e51cbf5d994c8cb725e70c8d7b7b40c9bfd3dcb10fae6fb"
    },
    {
      "path": "app/src/main/java/io/codecks/ui/clipboard/ClipboardStateAndPolicies.kt",
      "sha256": "e60bf6513ef5dbdd394a7e24be5dc617545b98e35f4acaf8d0fe37bf730c90ff"
    },
    {
      "path": "app/src/main/java/io/codecks/ui/clipboard/ClipboardViewModel.kt",
      "sha256": "3ceaad79db07cf4cf1641d1fd265c865f5aebc77d264c3b845b2520a9f5ca549"
    },
    {
      "path": "app/src/test/java/io/codecks/ui/clipboard/M15ClipboardCharacterizationTest.kt",
      "sha256": "8e0659428b6f629893cf68b295e929a20d00e87bef1687977a6dc7fb0cb35580"
    },
    {
      "path": "app/src/test/java/io/codecks/ui/clipboard/ClipboardStatusPolicyTest.kt",
      "sha256": "201d762a71e6b846a9f8604d790c801ea81c218a6e2fc7918bbb4fb9202b106f"
    },
    {
      "path": "app/src/androidTest/java/io/codecks/ui/clipboard/M15ClipboardPrivacyInstrumentedTest.kt",
      "sha256": "9c1936a66e00141fc7e720ba19604c4e83935b2b9868d0f650d402df0e36a10e"
    },
    {
      "path": "tools/evidence/collect_m15_clipboard_battery.py",
      "sha256": "7a5d06a333387cdaa538a30a26c80ce6e836cb4f6ec55d5f643383e9dc627f34"
    },
    {
      "path": "tools/evidence/validate_m15_clipboard_battery.py",
      "sha256": "a272b37a555ae25591a1ff4e6cb7d43da0db91a40a4176969ddba6608a6f0be5"
    },
    {
      "path": "tools/evidence/test_m15_clipboard_battery.py",
      "sha256": "a2303f83a01c4739f0b141374ac0c77e6dfa5c14822007e3da6a086938e35840"
    },
    {
      "path": "tools/evidence/schemas/autonomous-maturity-m15-clipboard-battery-v1.schema.json",
      "sha256": "5e40c67474dd0b3840f20fc30ad346870aae1e9475fa56b2e3894fb9575197ba"
    }
  ],
  "unitResult": {
    "path": "tasks/test-evidence/m15-clipboard-battery-cpu.xml",
    "sha256": "2b55add07b4e91501480639be30b52b961636e2596935f0c48be8edea5a3c4a8",
    "timestamp": "2026-08-17T23:04:03.325Z",
    "className": "io.codecks.ui.clipboard.M15ClipboardCharacterizationTest",
    "methods": [
      "batterySaverStopsAutomaticPollingWithoutChangingSessionAuthority",
      "clipboardImplementationHasNoWorkerWakeLockOrBackgroundService",
      "duplicateAndSelfEchoDoNotCreateSyncLoop",
      "largePayloadIsRepresentedByHashNotClipboardContent",
      "lastSyncReceiptPersistsOnlyClosedMetadata",
      "ordinarySynchronizedTextRequestsHiddenSystemPreview",
      "processRecreationDoesNotRestoreClipboardReadAuthority",
      "retryBackoffIsBounded",
      "simultaneousDifferentEditsProduceConflictInsteadOfLastWriterWin",
      "visibleUnlockedSessionIsTheOnlyAutomaticReadAuthority"
    ],
    "tests": 10,
    "failures": 0,
    "errors": 0,
    "skipped": 0
  },
  "managedResult": {
    "artifactKind": "SANITIZED_JUNIT_METADATA",
    "executedBinaryBinding": "APK_DIGESTS_BOUND",
    "path": "tasks/test-evidence/m15-clipboard-battery-managed.xml",
    "sha256": "043d4b20ba1a61730b35301a4188d57c486a9abbcca2abb6a0fc3be5b88f680c",
    "timestamp": "2026-08-17T23:07:45",
    "className": "io.codecks.ui.clipboard.M15ClipboardPrivacyInstrumentedTest",
    "methods": [
      "ordinarySynchronizedClipCarriesSensitivePreviewFlag",
      "synchronizedClipDescriptionUsesGenericLabel"
    ],
    "device": "pixel6Api35",
    "flavor": "playInternal",
    "tests": 2,
    "failures": 0,
    "errors": 0,
    "skipped": 0,
    "targetArtifact": {
      "path": "app/build/outputs/apk/playInternal/release/app-playInternal-release.apk",
      "applicationId": "app.codecks.internal",
      "sha256": "ee519555e484e2b2918e03641efd82ecff861211e82d45ddbf38c3afdd1475ec"
    },
    "testArtifact": {
      "path": "app/build/outputs/apk/androidTest/playInternal/release/app-playInternal-release-androidTest.apk",
      "applicationId": "app.codecks.internal.test",
      "sha256": "850b03c1f53c184501371cb6ee7c40cc5a21d50f84cfe228d28280ef873300c1"
    }
  },
  "lanes": [
    {
      "id": "cpu.visible_session_boundary",
      "status": "PASS",
      "evidence": "CPU_UNIT",
      "code": "exact_test_passed"
    },
    {
      "id": "cpu.battery_saver_policy",
      "status": "PASS",
      "evidence": "CPU_UNIT",
      "code": "exact_test_passed"
    },
    {
      "id": "cpu.duplicate_self_echo",
      "status": "PASS",
      "evidence": "CPU_UNIT",
      "code": "exact_test_passed"
    },
    {
      "id": "cpu.conflict_ordering",
      "status": "PASS",
      "evidence": "CPU_UNIT",
      "code": "exact_test_passed"
    },
    {
      "id": "cpu.large_payload_privacy",
      "status": "PASS",
      "evidence": "CPU_UNIT",
      "code": "exact_test_passed"
    },
    {
      "id": "cpu.last_sync_receipt_privacy",
      "status": "PASS",
      "evidence": "CPU_UNIT",
      "code": "exact_test_passed"
    },
    {
      "id": "cpu.system_preview_policy",
      "status": "PASS",
      "evidence": "CPU_UNIT",
      "code": "exact_test_passed"
    },
    {
      "id": "cpu.bounded_backoff",
      "status": "PASS",
      "evidence": "CPU_UNIT",
      "code": "exact_test_passed"
    },
    {
      "id": "cpu.process_recreation",
      "status": "PASS",
      "evidence": "CPU_UNIT",
      "code": "exact_test_passed"
    },
    {
      "id": "cpu.no_background_worker_wakelock",
      "status": "PASS",
      "evidence": "CPU_UNIT",
      "code": "exact_test_passed"
    },
    {
      "id": "emulator.sensitive_clip_flag",
      "status": "PASS",
      "evidence": "MANAGED_EMULATOR_PROXY",
      "code": "exact_test_passed"
    },
    {
      "id": "emulator.foreground_background",
      "status": "NOT_RUN",
      "evidence": "RUNTIME_OR_EXTERNAL",
      "code": "held_or_unavailable"
    },
    {
      "id": "emulator.screen_off_on_lock",
      "status": "NOT_RUN",
      "evidence": "RUNTIME_OR_EXTERNAL",
      "code": "held_or_unavailable"
    },
    {
      "id": "emulator.battery_restrictions",
      "status": "NOT_RUN",
      "evidence": "RUNTIME_OR_EXTERNAL",
      "code": "held_or_unavailable"
    },
    {
      "id": "current_mac.sleep_wake_reconnect",
      "status": "NOT_RUN",
      "evidence": "RUNTIME_OR_EXTERNAL",
      "code": "held_or_unavailable"
    },
    {
      "id": "physical.samsung_clipboard_toast",
      "status": "NOT_RUN",
      "evidence": "RUNTIME_OR_EXTERNAL",
      "code": "held_or_unavailable"
    },
    {
      "id": "physical.battery_characterization",
      "status": "NOT_RUN",
      "evidence": "RUNTIME_OR_EXTERNAL",
      "code": "held_or_unavailable"
    }
  ],
  "privacy": {
    "clipboardContentRecorded": false,
    "processOutputRecorded": false,
    "hostIdentityRecorded": false,
    "credentialRecorded": false
  },
  "summary": {
    "pass": 11,
    "fail": 0,
    "notRun": 6
  },
  "limitations": [
    "CPU tests prove deterministic policy and source wiring, not Android lifecycle behavior.",
    "Managed API-35 metadata and exact APK digests bind the sensitive-flag proxy; this is not physical-device proof.",
    "Foreground/background, screen lock, battery restriction, Samsung toast, and physical battery lanes remain NOT_RUN.",
    "Mac sleep/wake and reconnect were not changed or exercised in this implementation phase."
  ]
}
